{
  "id": "arrow-golden-04",
  "domain": "physics",
  "risk_level": "medium",
  "learning_objective": "Read a free-body diagram where each force arrow has the correct identity, direction, and attachment to the object.",
  "source_reference": {
    "arrows": [
      {
        "id": "weight",
        "name": "Weight (W)",
        "rgb": [
          214,
          48,
          49
        ],
        "direction_degrees": 270,
        "label_text": "W",
        "target": "object"
      },
      {
        "id": "normal",
        "name": "Normal force (N)",
        "rgb": [
          9,
          132,
          227
        ],
        "direction_degrees": 90,
        "label_text": "N",
        "target": "object"
      },
      {
        "id": "applied",
        "name": "Applied force (F)",
        "rgb": [
          0,
          148,
          50
        ],
        "direction_degrees": 0,
        "label_text": "F",
        "target": "object"
      },
      {
        "id": "friction",
        "name": "Friction (f)",
        "rgb": [
          230,
          126,
          34
        ],
        "direction_degrees": 180,
        "label_text": "f",
        "target": "object"
      }
    ],
    "object": {
      "kind": "box"
    }
  },
  "required_elements": [
    {
      "id": "object",
      "kind": "box",
      "name": "object under analysis",
      "count": 1
    },
    {
      "id": "arrows",
      "kind": "arrow",
      "name": "force arrows",
      "count": 4
    }
  ],
  "labels": [],
  "relations": [],
  "checks": [
    {
      "id": "arrow-count-matches",
      "type": "arrow_count_matches",
      "severity": "high",
      "description": "The number of detected force arrows should match the source forces."
    },
    {
      "id": "required-arrows-present",
      "type": "required_arrows_present",
      "severity": "critical",
      "description": "Every required force arrow must be present with its declared color identity.",
      "params": {
        "color_match_distance": 60.0
      }
    },
    {
      "id": "arrow-directions-correct",
      "type": "arrow_directions_correct",
      "severity": "critical",
      "description": "Each force arrow must point in its physically correct direction.",
      "params": {
        "angle_tolerance_degrees": 15.0,
        "color_match_distance": 60.0
      }
    },
    {
      "id": "arrow-anchors-object",
      "type": "arrow_anchors_object",
      "severity": "high",
      "description": "Each force arrow must be attached to the object it acts on.",
      "params": {
        "anchor_tolerance_px": 14.0,
        "color_match_distance": 60.0
      }
    }
  ]
}