{
  "id": "flowchart-mutated-07",
  "domain": "computer_science",
  "risk_level": "medium",
  "learning_objective": "Read a vertical-chain flowchart where each node has the correct shape, color identity, and label, and each directed connector links the declared nodes.",
  "source_reference": {
    "nodes": [
      {
        "id": "start",
        "name": "Start",
        "rgb": [
          214,
          48,
          49
        ],
        "shape": "rectangle",
        "label_text": "Start"
      },
      {
        "id": "input",
        "name": "Input",
        "rgb": [
          9,
          132,
          227
        ],
        "shape": "rectangle",
        "label_text": "Input"
      },
      {
        "id": "decision",
        "name": "Decision",
        "rgb": [
          230,
          126,
          34
        ],
        "shape": "diamond",
        "label_text": "Decision"
      },
      {
        "id": "process",
        "name": "Process",
        "rgb": [
          0,
          148,
          50
        ],
        "shape": "rectangle",
        "label_text": "Process"
      },
      {
        "id": "end",
        "name": "End",
        "rgb": [
          142,
          68,
          173
        ],
        "shape": "rectangle",
        "label_text": "End"
      }
    ],
    "connectors": [
      {
        "from_id": "start",
        "to_id": "input"
      },
      {
        "from_id": "input",
        "to_id": "decision"
      },
      {
        "from_id": "decision",
        "to_id": "process"
      },
      {
        "from_id": "process",
        "to_id": "end"
      }
    ]
  },
  "required_elements": [
    {
      "id": "nodes",
      "kind": "node",
      "name": "flowchart nodes",
      "count": 5
    }
  ],
  "labels": [],
  "relations": [],
  "checks": [
    {
      "id": "node-count-matches",
      "type": "node_count_matches",
      "severity": "high",
      "description": "The number of detected nodes should match the declared nodes."
    },
    {
      "id": "required-nodes-present",
      "type": "required_nodes_present",
      "severity": "critical",
      "description": "Every required node must be present with its declared color identity.",
      "params": {
        "color_match_distance": 60.0
      }
    },
    {
      "id": "node-shape-correct",
      "type": "node_shape_correct",
      "severity": "critical",
      "description": "Each node must render with its declared shape (rectangle or diamond).",
      "params": {
        "color_match_distance": 60.0
      }
    },
    {
      "id": "node-label-correct",
      "type": "node_label_correct",
      "severity": "high",
      "description": "Each labeled node's decoded text must match its declared label.",
      "params": {
        "color_match_distance": 60.0
      }
    },
    {
      "id": "connector-links-correct",
      "type": "connector_links_correct",
      "severity": "critical",
      "description": "Every declared directed connector must be found in the rendered arrow evidence.",
      "params": {
        "color_match_distance": 60.0
      }
    }
  ]
}