{
  "id": "chart-mutated-02",
  "domain": "chart",
  "risk_level": "medium",
  "learning_objective": "Compare rainfall across three months with accurate bar heights.",
  "source_reference": {
    "data": [
      {
        "month": "Jan",
        "rainfall_mm": 40
      },
      {
        "month": "Feb",
        "rainfall_mm": 70
      },
      {
        "month": "Mar",
        "rainfall_mm": 55
      }
    ]
  },
  "required_elements": [
    {
      "id": "x_axis",
      "kind": "axis",
      "name": "month axis",
      "count": 1
    },
    {
      "id": "y_axis",
      "kind": "axis",
      "name": "rainfall axis",
      "count": 1
    },
    {
      "id": "bars",
      "kind": "bar",
      "name": "rainfall bars",
      "count": 3
    }
  ],
  "labels": [
    {
      "text": "Jan",
      "target": "bars"
    },
    {
      "text": "Feb",
      "target": "bars"
    },
    {
      "text": "Mar",
      "target": "bars"
    },
    {
      "text": "Rainfall (mm)",
      "target": "y_axis"
    }
  ],
  "relations": [],
  "checks": [
    {
      "id": "bar-values-match-data",
      "type": "chart_value_consistency",
      "severity": "critical",
      "description": "Bar heights should match the source data within tolerance.",
      "params": {
        "relative_tolerance": 0.05
      }
    },
    {
      "id": "axis-label-present",
      "type": "label_present",
      "severity": "high",
      "description": "The y-axis label must be visible."
    },
    {
      "id": "axis-unit-present",
      "type": "axis_unit_present",
      "severity": "high",
      "description": "The y-axis unit must match the expected unit."
    },
    {
      "id": "bar-count-matches",
      "type": "bar_count_matches",
      "severity": "high",
      "description": "The number of bars should match the source data."
    }
  ]
}